title,seller,property_type,address,price,bedrooms,bathrooms,built_area,land_area,description,publication_date,zip_code,parking
"Casa en venta, en san Felipe del agua, con amplio jardín",lamudi,Casa en Fraccionamiento,volcanes,12250000,4.0,3.0,217.0,514.0,"Residencia en venta ubicada en la zona más exclusiva de la ciudad d oaxaca, cuenta con todos los servicios Sala comedor Cocina Cuarto de TV 4 recámaras 3 baños completos  Cuarto de servicio Área de lavado Terraza con asador Cochera para 3 vehículos Porton eléctrico Área de jardín Cisterna de 19 mil litros",20 abr 2023 - Publicado por Inmobiliaria Cemkas,68020.0,3.0
"SE VENDE AMPLIA CASA EN EL FRACC.  LA LOMA, COLONIA LA CASCADA",lamudi,Casa,estrella,4800000,4.0,4.0,284.0,278.0,"CADA ZONA TIENE SU MAGIA!!SE VENDE AMPLIA CASA EN EN EL FRACC. LA LOMA, COLONIA LA CASCADA.Amplia casa en venta en el fraccionamiento la loma linda, la cascada.ubicada en un fraccionamiento cómodo y seguro donde puedes llegar fácilmente caminando a la col. Reforma, al Barrio de Xochimilco, cuenta con vigilancia las 24 horas del día.- Primer nivelEstacionamiento para 3 autosUna recámara con baño completoPatio de servicioCisterna de 15.000 mil litrosSistema de seguridad con barda electrificada.Segundo nivelSalaComedorCocina integralSala de televisión amplia1 recámara con baño completo2 recamaras con baño completoPatio ( las recamaras son muy amplias )Superficie de terreno: 284M2Construcción: 279 M2 renta por día: $1,200.00 Citas e informes al95",20 abr 2023 - Publicado por GABRO,68045.0,3.0
SE VENDE HERMOSA RESIDENCIA EN SAN FELIPE DEL AGUA,lamudi,Casa,san felipe del agua,11500000,5.0,6.0,500.0,500.0,"Descripción.ENAMÓRATE DE ESTA EXCLUSIVA PROPIEDAD EN SAN FELIPE DEL AGUA,Se vende hermosa Casa en San Felipe del Agua, ubicada a unas cuadras de la iglesia, construida en tres niveles con excelentes acabadosDirección: númeroPrimer nivel.Cochera techada para 2 autos.SalaComedorMedio bañoCisterna de 10,000 litros.Jardín el cual tiene sembrado un árbol pochote representativo del estadoCocina integral Incluye estufa y campanaPatio de servicio.Medio baño y estudio. Segundo nivel.Recámara 1 con closet y baño completo.Recámara 2 con vestidor y baño completo.Recámara 3 con closet, baño completo.Tercer nivel.Recámara 5 con closet y baño completo.Amplio rooof garden completamente techadoCuarto de máquinascuarto de servicioÁrea de socialMedio baño.En el techo de la recámara del 3 nivel están instalados el tinaco y gas estacionario.Todas las recamaras y sala comedor cuentan con la preparación para clima.220 metros de terreno.500 metros de construcción.Precio de venta:$ 11,500,000.00 ( once millones quinientos mil pesos 00/100 M.N )CITAS E INFORMES AL",21 abr 2023 - Publicado por GABRO,68026.0,2.0
"Espaciosa residencia de 4 recámaras 3 y medio baños, inmenso jardín",lamudi,Casa,volcanes,7950000,4.0,4.0,190.0,736.0,"Esta puede ser la casa de sus sueños hechos realidad; sólida construcción de dos plantas, escalinata en piedra para dar acceso a la entrada principal, recibidor, medio baño de visitas, finos detalles de talavera, chimenea de ladrillo, ventanales de piso a techo, sala de doble altura, comedor con acceso a in gran balcón, cocina integral, estudio y por si fuera poco cuenta con una habitación en planta baja con su propio baño. En el primer nivel tenemos la espaciosa recámara principal con su baño completo y closet, además de una terraza con vista panorámica hacia la ciudad y hacia las montaños. Cuenta además con otras dos habitaciones que comparten un baño completo. En el exterior tiene una terraza con vista hermosa, ésta da a el gran jardín muy bien mantenido y tiene plantas de hornato así como árboles frutales y palmeras. La cochera para dos autos tiene su portón eléctrico. La casa se encuentra hacia la parte de atrás de la Igleia de San Felipe del Agua en la parte central del municipio. Sin duda una gran oportunidad de adquirir una propiedad con gran plusvalía. Llame para concertar una cita.",20 abr 2023 - Publicado por Condor Bienes Raices,68020.0,2.0
Casa nueva 5 habitaciones 6 baños terraza para fiestas X Plaza Bella,lamudi,Casa,lindavista,4600000,5.0,6.0,385.0,200.0,"En venta nueva y hermosa residencia a todo lujo a 6 cuadras de Plaza Bella. En realidad es una casa de bajo perfil ya que desde el exterior parecería una casa normal, no obstante es una residencia; cuenta con 2 cocheras con portón eléctrico, bodega, y una de las cocheras puede ser usada como despacho ya que cuenta con un baño completo.Sala y comedor amplios, cocina integral , terraza, asador, hielera, jardín de macetas y área de lavado. Cuenta igualmente enplanta baja con una habitación con su baño completo y un medio baño de visitas.En el segundo piso tiene 4 habitaciones y 3 baños, la habitación principal con su walking closet y es muy espaciosa. Tiene igualmente una terraza grande en este nivel.Es realmente una joya de diseño de espacios. Llmae hoy mismo para una cita:",21 abr 2023 - Publicado por Condor Bienes Raices,68030.0,2.0
CASA EN SAN MARTIN A 2 KM DEL CENTRO DE LA CIUDAD,lamudi,Casa,emiliano zapata,2100000,5.0,3.0,1.0,200.0,"¡EXCELENTE OPORTUNIDAD!! PROPIEDAD EN VENTA EN SAN MARTIN MEXICAPAM, EN EL MUNICIPIO DE OAXACA DE JUAREZ CON UNA EXCELENTE UBICACIÓN: 1.3 km del Periferico 2 Km del centro de la ciudad 1.4 Km de Plaza Bella  500 mts de Riveras de Atoyac Terreno 200 mts2 Inversión $2,100,000 Mas información al",20 abr 2023 - Publicado por Tu casa en Oaxaca,68148.0,
"Casa en venta 3 niveles, 10 recámaras, 9 baños, céntrica",lamudi,Casa,estrella,5700000,10.0,9.0,430.0,166.0,Hermosa casa ubicada alrededor de plazas comerciales y negocios. Se encuentra cerca de centros educativos de todos los niveles. Cuenta con todos los servicios y calles pavimentadas,20 abr 2023 - Publicado por Marino Bienes Raices,68045.0,
VENDO CASA 3 RECAMARAS 1 ESTUDIO COLONIA JARDIN OAXACA,lamudi,Casa,jardin,3200000,4.0,3.0,231.0,186.0,"casa en venta ubicada en colonia jardinConstruida con material tradicionalZona tranquila y urbanizadaColinda con colonia volcanes y san luis beltraristicas:Cochera para 1 auto1 estudioBaño completo1 patio.Cisterna 10,000 lts.Primer nivel:SalaComedorCocina integralPatio trasero1 baño completo1 estudio o RecámaraSegundo nivel:Recamara principal con balcon1 amplio vestidor con madera de pino.1 baño completo.2 recamaras con piso amaderado1 con balcon.Tercer nivel:1bodega o cuarto de servicioTecho impermeabilizado para adaptar una terrazaAgradable vista.Tinaco 1,100Tanque estacionario 300 lts.Cuenta con todos los serviciosPrevia cita",20 abr 2023 - Publicado por Inmuebles Oaxaca,68023.0,1.0
"Casa en venta nueva de 3 recámaras, Terminal de Autobuses. Santa Cruz Xoxocotlán",lamudi,Casa en Condominio,estrella,2100000,3.0,1.0,90.0,135.0,"Venga a conocer maravillosa casa, lista para estrenarse! Chapa electrónica de código, huella y llave Iluminación automatizada por comandos de voz y dispositivos móviles Áreas comunes con cancha de football, cestas de basketball, gimnasio al aire libre y sanitrios Acceso controlado y vigilancias 24 horas",20 abr 2023 - Publicado por Marino Bienes Raices,68045.0,
"Rancho de los Anhelos en Venta, Banda de Oaxaca en San Miguel de Allende",lamudi,Casa,barrio xochimilco,2000000,2.0,1.0,124.0,2629.0,"Sobre la carretera hacia la comunidad Banda en un camino tranquilo, está una propiedad de la que te quiero contar.En el centro de un terreno que mide 2,629.059 m2 están los comienzos de una casa que tiene por construcción 124.39 m2 con espacio para cocina, comedor, sala, 1 baño completo, y dos recamaras. El toque final con los acabados a tu gusto terminará de mostrarte  la casa de campo de tus sueños. Tienes la posibilidad de seguir construyendo en este espacio por el gran terreno que hay disponible, está lo bastante lejos para vivir tranquilo fuera del ruido de la ciudad y a la vez lo convenientemente cerca por su acceso fácil a carreteras principales hacia la ciudad.Como inversión también es excelente pudiendo desarrollar un proyecto de cabañas por ejemplo. Los servicios de agua y energía eléctrica están totalmente disponibles y a la mano.  La zona ya está habitada con familias de la comunidad y algunos comercios locales. El paso de transporte público durante el día también es una realidad en la zona.Muy cerca del río laja y de la Presita de Santa Rosa, es una zona con mucha agua.------------------------------------On the road to the Banda community on a quiet road, there is a property that I want to tell you about.In the center of a land that measures 2,629.059 m2 are the beginnings of a house that has a construction of 124.39 m2 with space for kitchen, dining room, living room, 1 full bathroom, and two bedrooms. The final touch with the finishes to your liking will finish showing you the country house of your dreams.You have the possibility to continue in this space due to the large land that is available, it is far enough to live quietly outside the noise of the city and at the same time it is conveniently close due to its easy access to main roads to the city.As an investment it is also excellent, being able to develop a cabin project for example. Water and electricity services are fully available and at hand. The area is already inhabited with families from the community and some local businesses. The passage of public transport during the day is also a reality in the area.Very close to the Laja River and the Presita de Santa Rosa, it is an area with a lot of water.*Cooperative Agent. EasyBroker ID: EB-JW4371",28 feb 2023 - Publicado por RESMA Real Estate / Bienes Raíces,68040.0,
CASA  EN REMATE ZONA XOXO-CUILAPAM Oaxaca,lamudi,Casa, los rios,1500000,4.0,3.0,160.0,200.0,"CASA CON AMPLIO TERRENO EN CUILAPAM OAX *EXCELENTE OPORTUNIDAD DE INVERSIÓN* Ubicada en los límites de santa Cruz xoxocotlan y CUILAPAM DE GUERRERO,  *sector cruz blanca Rancho Aguayo* , a solo 30 minutos del centro de la ciudad y a solo 5 min de la camara de diputados y de la universidad Anáhuac  *1,500,000 Sup terreno 200 m2 Descripción:Consta de dos construcciones en su interior: CASA HABITACIÓN PRINCIPALConstruida en dos niveles Planta baja (habitable)SalaComedor Cocina Recamara / Estudio Baño completo ( separado Wc y regadera) Patio de servicio * *Pisos con Acabados  en loseta , muros y techos aplanados en cemento , con excepción del baño este está en obra negra, cableado en toda esta planta.*  Planta alta ( *OBRA NEGRA)*   3 Recámaras Vestíbulo 1Baño completo  *BUNGALOW con terraza y 1 baño completo*  *( habitable)* Construido en un solo nível con Muros de ladrillo, aplanado fino y piso pulido, el baño cuenta con pisos en azulejo , calentador.El techo de este es base de galva teja. *CUENTA CON LUZ, DRENAJEPOZO DE AGUA ANILLADO CON BOMBA, TINACO DE 1,100 lts *PROPIEDAD, REGISTRO DEFINITIVO, LIBRE DE GRAVAMEN.* Acepta Pago en efectivo o crédito hipotecario el que aplique sino cuenta con uno le apoyamos en la asesoría y trámiteCITA PREVIAPaulina Jiménez,. EasyBroker ID: EB-MM1441",9 may 2023 - Publicado por PROISA INMOBILIARIA,68028.0,
CASA NUEVA  ZONA NORTE DE LA CIUDAD DE OAXACA,lamudi,Casa,microondas,3950000,4.0,3.0,220.0,150.0,"AMPLIA CASA NUEVA  DE 150 M2  ZONA NORTE DE ALTA PLUSVALÍA,  CON RÁPIDOS ACCESOS A COLONIA REFORMA, SAN FELPE DEL AGUA Y CENTRO DE LA CIUDAD, A SOLO 3 KM AL NORTE DEL BARRIO DE XOCHIMILCO CONSTRUCCIÓN TRADICIONALPLANTA BAJA:*COCHERA PARA 2 AUTOS * PORTÓN ELÉCTRICO*SALA*1  BAÑO COMPLETO*  ESTUDIO/RECAMARA *COMEDOR*COCINA EQUIPADA (cocina integral y barra de granito)*CISTERNA CON BOMBAPLANTA ALTA:* RECAMARA PRINCIPAL CON BAÑO COMPLETO ( vestidor, aire acondicionado)*1 BAÑO COMPLETO COMPARTIDO*2 RECAMARAS SECUNDARIAS CON CLOSETS AZOTEA:"" PERGOLA*TERRAZA CON ASADOR (vista a las montañas)NOTA: Pisos de loseta calidad InterceramicMAYORES INFORMES PREVIA VITACEL:,. EasyBroker ID: EB-MB6762",9 may 2023 - Publicado por PROISA INMOBILIARIA,68043.0,2.0
SE VENDE CASA EN LA COLONIA LIBERTAD - (3),lamudi,Casa,ejido guadalupe victoria,2750000,5.0,3.0,103.0,109.0,"Se vende propiedad para inversionistas, con ubicación estratégica, muy cerca de la Central de Abastos y el Centro de la ciudad, lista para habitar o ideal para cualquier negocio. (3)",12 jul 2023 - Publicado por REMAX cantera,68277.0,
SE VENDE CASA EN FRACCIONAMIENTO LA JOYA,lamudi,Casa en Fraccionamiento,lazaro cardenas 1a secc,1299000,3.0,1.0,80.0,80.0,"ESTA BONITA CASA CUENTA CON LO SIGUIENTE  3 recámaras  2 Baños  Patio de servicio  cisterna de 5mil litros  Cajón de estacionamiento  Sala - Comedor  Cocina $1,299,000Dentro de fraccionamiento",24 abr 2023 - Publicado por Bienes Raíces Oaxaca,68140.0,1.0
VENDO BONITA CASA EN FRACCIONAMIENTO JARDINES DE BRENAMIEL,lamudi,Casa,estrella,1985000,3.0,2.0,160.0,104.0,"endo bonita casa en fracc. Jardines de brenamiel Caracteristicas:  Planta baja: Sala comedor Cocina integral Cochera techada Patio de sericio Medio baño para isitas Patio de laado  Planta alta :1 recamara con closets y baño completo 2 recamaras con closets que comparten baño completo Calentador solar  Cisterna de 5000 litros   104metros de terreno y de construcción 160  $1'985,000",20 abr 2023 - Publicado por INMOBILIARIA GAMALY,68045.0,1.0
"SE VENDE CASA DE UNA SOLA PLANTA, EN SAN MARTÍN MEXICAPAN",lamudi,Casa,lazaro cardenas 1a secc,3000000,3.0,3.0,152.0,347.0,"CASA DE UNA SOLA PLANTA.CUANTA CON:SALACOMEDOR COCINA INTEGRAL PATIO AMPLIO COCHERA3 RECAMARAS CADA UNA CON BAÑO COMPLETOBODEGATODOS LOS SERVICIOS.PRECIO:$3""000,000",12 may 2023 - Publicado por INMOBILIARIA GAMALY,68140.0,3.0
¡¡CASA EN VENTA!! En el Fraccionamiento Arboledas Zaachila,lamudi,Casa en Fraccionamiento,lazaro cardenas 1a secc,1600000,3.0,2.0,80.0,60.0,"¡¡CASA EN VENTA!! En el Fraccionamiento Arboledas Zaachila, en Xoxocotlán Oaxaca",21 abr 2023 - Publicado por INMOBILIARIA GAMALY,68140.0,
SE VENDE HERMOSA Y AMPLIA CASA EN DONAJI ZONA NORTE,lamudi,Casa,volcanes,5300000,5.0,7.0,263.0,221.0,"🏡Hermosa casa en Venta en colonia Donaji zona norte de la ciudad, 🏡con amplio Jardin.🏡🔹Casa en esquina ▪️Terreno: 221.28 m2▪️construcción: 263.09 m2🔹$5,300,000Planta Baja✅Sala✅Comedor✅Cocina✅2 recamaras con baño✅1/2 baño✅Cuarto de lavado✅Área de Servicio✅Cochera para dos autosPLANTA ALTA✅1 Recamara con vestidor y baño✅2 recamaras con baño✅Sala de TV✅1/2 baño",24 abr 2023 - Publicado por Bienes Raíces Oaxaca,68020.0,1.0
HERMOSA CASA EN VENTA SAN FRANCISCO TUTLA,lamudi,Casa,barrio xochimilco,3750000,3.0,2.0,323.0,184.0,"$3,750,000.00PLANTA BAJA 2 COCHERAS ENTRADA PEATONAL CISTERNA 5.500 LTS  APROX.SALA COMEDOR COCINA INTEGRAL ISLA ALACENA 1/2 BAÑO   AREA DE SERVICIO JARDINPLANTA ALTA PRIMER NIVELRECAMARA PRINCIPAL CON VESTIDOR BAÑO COMPLETO Y JACUZZI 2 RECAMARAS AMPLIAS UNA  CON CLOSET Y UN BAÑO PARA COMPARTIR   PLANTA  TERCER NIVEL RECAMARA CON BAÑO COMPLETO MULTIFUNCIONAL ROOF GARDEN PARA 60 PERSONAS CON 1/2 BAÑO BAR ASADOR Y TERRAZA. EasyBroker ID: EB-IJ4384",19 feb 2023 - Publicado por NORA BAEZ RAMIREZ,68040.0,2.0
HERMOSA CASA EN VENTA EN LA COLONIA CASCADA,lamudi,Casa,la cascada,4750000,3.0,3.0,239.0,239.0,"🔹HERMOSA CASA EN VENTA EN COLONIA LA CASCADA 🔹📌(Excelente ubicación)BIENVENIDOS LOS CREDITOS🔗239 M2Características🔸Planta baja:  ▪️Garage para un auto  ▪️Cuarto de servicio  ▪️Sala  ▪️Comedor  ▪️Cocina  ▪️Estudio  ▪️Medio baño  ▪️Patio trasero🔸Plata Alta:  ▪️1 Recámara principal con Closet/vestidor y baño  ▪️2 recámaras secundarias  ▪️1 baño completo  ▪️Cerca electrificada  ▪️Cámaras de seguridad  ▪️Tanque estacionario  ▪️Cisterna de 8,000 lt  🔖$ 4,750,000Aprovecha esta oportunidad en zona de Alta Plusvalia",24 abr 2023 - Publicado por Bienes Raíces Oaxaca,68040.0,1.0
CASA EN VENTA EN LA REFORMA - (3),lamudi,Casa,diaz ordaz,4500000,2.0,2.0,140.0,161.0,"EN UNA DE LAS CALLES MAS TRANQUILAS DE LA REFORMA SE ENCUENTRA ESTA CASA CON TODOS LOS SERVICIOS CERCA, ESTA CASA CUENTA CON UN PATIO PARA PASAR UNOS GRATOS MOMENTOS CON LA FAMILIA (3)",13 jun 2023 - Publicado por REMAX cantera,68040.0,
CASA EN VENTA CON LOCALES COMERCIALES  - (3),lamudi,Casa,oaxaca centro,20450000,5.0,4.0,407.0,545.0,"CASA HABITACION CON DISTRIBUIDOR, DESAYUNADOR, SALA COMEDOR,COCINA, TRES RECAMARAS, BAÑO COMPLETO, CUARTO DE LAVADO Y PLANCHADO,CORREDORES Y PATIO, Y AL FONDO UN DEPARTAMENTO CON SALA COMEDORCOCINA Y DOS RECAMARASTIENE 2 LOCALES COMERCIALES (3)",6 ago 2023 - Publicado por REMAX cantera,68000.0,
CASA EN VENTA  - (3),lamudi,Casa,san martin mexicapan,1800000,4.0,2.0,300.0,200.0,"CASA EN VENTA, UBICADA EN CALLE NOCHE BUENA NUMERO 104 COL. AZUCENAS, SAN MARTIN MEXICAPAM. OAXACA DE JUAREZ, LA PROPIEDAD ESTA DIVIDIDA EN DOS PLANTAS CUENTA CON 2 RECAMARAS EN LA PLANTA DE ARRIBA Y DOS RECAMARAS EN LA PLANTA BAJA CADA PLANTA CON SU RESPECTIVO BAÑO, COCINA, PATIO.  CUENTA CON TODOS LOS SERVICIOS AGUA POTABLE, LUZ Y DRENAJE.  (3)","Hace 4 días, 16 horas - Publicado por REMAX cantera",68140.0,
CASA EN EL CENTRO DE OAXACA - (3),lamudi,Casa,estrella,35000000,10.0,4.0,583.0,395.0,"PRECIOSA CASA EN EL CENTRO DE OAXACA EN PERFECTAS CONDICIONES, CON MUCHA HISTORIA, DONDE VIVIO EL GENERAL GARCIA VIGIL (3)",24 abr 2023 - Publicado por REMAX cantera,68045.0,
CASA EN VENTA EN LA COLONIA REFORMA - (3),lamudi,Casa,reforma,8900000,5.0,4.0,378.0,270.0,"Magnifica oportunidad de inversión, en unos de los sectores más cotizados de la ciudad de Oaxaca, casa en venta con uso de suelo Mixto, cuenta con avalúo,  planos estructurales, planos arquitectónicos, y dictamen de seguridad estructural con conclusión de que NO PRESENTA DAÑOS. (3)",10 mar 2023 - Publicado por REMAX cantera,68050.0,
Se vende casa en Fraccionamiento. - (3),lamudi,Casa en Condominio, villas montealban,1290000,3.0,2.0,61.0,94.0,"Esta casa cuenta con estacionamiento privado hasta 2 vehículos.En planta baja se encuentra la sala comedor, cocina con barra desayunador, 2 recamaras una de ellas podría adecuarse a estudio, baño completo y área de servicio.En la segunda planta, recamara  y baño completo. (3)",4 ago 2023 - Publicado por REMAX cantera,68143.0,2.0
Casa en Obra Negra - (3),lamudi,Casa,lazaro cardenas 1a secc,2975000,4.0,4.0,600.0,240.0,"Casa en Obra Negra en Venta.  Con 600 metros de construcción y 240 metros de terreno. La propiedad se vende tal cual se muestran las fotos, para elegir los acabados y distribución que desees en tu nueva casa. El proyecto está conformado de la siguiente manera.  Planta baja: cochera, sala comedor, cocina,  1/2 baño y cisterna.Planta  alta: 4  habitaciones, 4 baños y una sala de estar.Rooftop: Terraza de descanso, convivencia y cuarto de servicio.Propiedad Ejidal. (3)",10 jun 2023 - Publicado por REMAX cantera,68140.0,1.0
CASA EN EL EX-MARQUESADO SOBRE AV. PRINCIPAL - (3),lamudi,Casa,oaxaca centro,12500000,7.0,5.0,340.0,418.0,"Hermosa casa catalogada estilo colonial en el barrio del Exmarquesado, la propiedad cuenta con patio central, 3 recamaras, 3 baños, cocina, comedor y área de servicios, con dos amplios locales comerciales (40m2 y 20m2) y dos departamentos con entrada independiente de 2 recamaras cada uno, ideal para diferentes giros de inversión, ubicada en Avenida importante que le otorga gran conectividad con la ciudad y el centro histórico de Oaxaca. (3)",1 abr 2023 - Publicado por REMAX cantera,68000.0,
ATENCION INVERSIONISTAS - (3),lamudi,Casa,benito juarez,13000000,1.0,1.0,890.0,1225.0,"Atención inversionistasRemax Cantera propone casa en venta, la cual se encuentra en una excelente ubicación, a media cuadra de la Carretera Internacional, en Pueblo Nuevo Oaxaca, cerca del crucero comercial de Viguera, rodeada de centros comerciales: farmacias del ahorro, Coppel, Miniabastos, escuelas, plantel educativo COBAO. A 20 minutos de la ciudad de Oaxaca, en automóvil.Esta propiedad se compone de un edificio de dos niveles utilizado para casa habitación, y otro edificio con habitaciones con baño para renta.Casa principal, cuenta con: sala, comedor, dos cocinas, una de ellas es cocina tradicional y la otra cuenta con cocina integral en renovación, 10 recámaras, la recamara principal cuenta con baño incluido, y las otras 9 recámaras comparten 4 baños.Recámaras y departamento para renta:  cuenta con 10 recámaras con baño integrado, 4 recamaras con baño compartido. Además, cuenta con un departamento de 2 recámaras, sala, comedor, cocina, 1 baño y patio de servicio. Cuenta con un salón de eventos especiales, con todos los servicios. Área arbolada y gran jardín, excelente para hotel, restaurante, oficinas.Cuenta con todos los servicios: agua potable, cisterna, energía eléctrica, drenaje. Calles pavimentadas.Régimen ejidal. (3)",31 jul 2023 - Publicado por REMAX cantera,68030.0,
CASA EN VENTA DE 3 RECAMARAS CON ESTUDIO EN LA LOMA,lamudi,Casa en Fraccionamiento, la loma ampliacion,6500000,3.0,4.0,230.0,240.0,"Casa en venta en Fraccionamiento Privado con vigilancia las 24 horas con estricta vigilancia zona segura y tranquila, cerca de la Colonia Reforma, San Felipe y a escasos minutos al centro y Xochimilco, acceso rápido a comercios como escuelas, bancos, plazas, mercados, hospitales, etc.Se encuentra en calle privada.Una de las mejores zonas para vivir, el Fraccionamiento tiene jardines privados.Apta para remodelación al gusto del comprador.Superficie de terreno: 240 m2Superficie de construcción: 230 m2PROPIEDAD PUBLICA CON CARÁCTER DEFINITIVO.PLANTA BAJA:. Cochera para 2 autos, portón eléctrico, con jardineras.. Sala.. Comedor.. Cocina integral con estufa.. Un medio baño de visitas. (se puede convertir en baño completo). Alacena.. Estudio u oficina.. Jardín amplio trasero.. Cuarto de servicio.. Baño completo.. Patio de servicio (Lavadero, instalación para lavadora)SEGUNDO NIVEL:. Hall.. Un baño completo.. Tres Recamaras con closets cada una. (La principal con baño completo)AMENIDADES.. Cisterna de 3,500 litros. (se puede ampliar la cisterna).. Gas estacionario.PRECIO DE RENTA: $6,500,000.00Previa cita:""INMOBILIARIA ZAGAO""Calle Boulevard de La Paz 102Colinas de La Soledad, Oaxaca.MARIA ZARATE OROZCO  GONZALO GALVAN FLORES",20 abr 2023 - Publicado por Inmobiliaria Zagao,68045.0,2.0
PROPIEDAD CON 6 DEPARTAMENTOS Y CASA - (3),lamudi,Casa,reforma,30000000,10.0,10.0,760.0,839.0,"PROPIEDAD MUY BIEN UBICADA CON 6 DEPARTAMENTOS Y CASA, IDEAL PARA INVERSIONISTAS PREDIO CONSTRUIDO EN CUATRO BLOQUES, 1.-) UN EDIFICIO DE TRES NIVELES QUE TIENE EN PLANTA BAJA COCHERA Y LOS DOS NIVELES SUPERIORES UNOSDEPARTAMENTOS QUE CONSTAN DE UNA SALA, COMEDOR, COCINETA, UNA RECAMARA Y UN BAÑO COMPLETO, 2.-)CASA HABITACION EN UN SOLO NIVEL QUECONSTA DE ACCESO DE LA CALLE, RECIBIDOR, SALA FAMILIAR, COMEDOR, COCINA, PASILLO DISTRUBUIDOR, MEDIO BAÑO DE VISITAS, TRES RECAMARAS , UNBAÑO COMPLETO, RECAMARA PRINCIPAL CON BAÑO COMPLETO Y VESTIDOR, TERRAZA CUBIERTA Y AREAS DE JARDIN. 3.-) DEPARTAMENTOS DE UNA SOLARECAMARA CONSTRUIDOS EN DOS NIVELES CON ESTANCIA-COMEDOR,COCINA, ESCALERAS Y EN PLANTA ALTA UNA RECAMARA CON BAÑO COMPLETO. Y 4.-)DEPARTAMENTOS DE DOS RECAMARAS EN DOS NIVELES, Y CONSTAN EN PLANTA BAJA ESTANCIA, COMEDOR, COCINA, MEDIO BAÑO ESCALERAS Y EN PLANTAALTA DOS RECAMARAS CON AREAS DE CLOSETS Y UN BAÑO COMPLETO.ES UNA CONSTRUCCION DE TIPO TRADICIONAL, SE SUPONE CON CIMENTACIONES DE PIEDRA CANTERA Y CON ZAPATAS DE CONCRETO AISLADAS ARMADAS CONVARILLAS DE ACERO, MUROS DE LADRILLO ROJO RECOCIDO DE 14 CMS DE ESPESOR REPELLADOS Y PINTADOS, REFORZADOS CON CADENAS Y CASTILLOS DECONCRETO ARMADO, TECHOS DE LOSA DE CONCRETO ARMADO DE 12 CMS DE ESP. ARMADO CON VARILLAS DE 1/2"" y 3/8"" EN CLAROS LARGOS Y MEDIANOS,PISOS CON LOSETA VIDRIADA DE BUENA CALIDAD, ACABADO EN MUROS CON MEZCLA DE CEMENTO CAL ARENA CON ACABADO FINO Y YESO LISO, PINTADOSCON VINILICA, PLAFONES CON PINTURA VINILICA Y YESO LISO, PUERTAS DE INTERCOMUNICACION DE TAMBOR DE MADERA Y DE ANGULOS LIGEROS CONFORRO DE LAMINA, VENTANERIA DE ALUMINIO ANODIZADO, INSTALACIONES ELECTRICAS COMPLETAS Y OCULTAS POR PLAFON Y MUROS EN MANGERAPOLIDUCTO, INSTALACIONES SANITARIAS COMPLETAS Y OCULTAS, MUEBLES DE BAÑOS PORCELANIZADOS DE COLOR, REGISTROS REGLAMENTARIOS, AZOTEASCON EMULSION ASFALTICA Y TEJA, TINACOS DE TIPO ROTOPLAS, BARDAS COLINDANTES REPELLADAS CON MORTERO ACABADO RUSTICO Y PORTONES DEACCESO DE MADERA CON HERRAJES METALICO (3)",10 ago 2023 - Publicado por REMAX cantera,68050.0,1.0
Casa en Venta en la Colonia Volcanes - (3),lamudi,Casa,volcanes,7400000,6.0,4.0,350.0,366.0,"Propiedad en la colonia Volcanes, Oaxaca, cuenta con seis habitaciones, todas equipadas con clóset para mayor comodidad. Además, cuenta con cocina integral, una terraza para disfrutar al aire libre, un cuarto de televisión para momentos de entretenimiento y un práctico cuarto de lavado. Los cuatro baños completos aseguran que haya suficiente espacio para todos los residentes. Y para aquellos que poseen varios autos, el estacionamiento tiene capacidad para cinco vehículos, es una ventaja adicional. Una vivienda ideal para una familia numerosa o aquellos que buscan mucho espacio y comodidades en su hogar.Además de sus amplias comodidades, esta casa en la colonia Volcanes, Oaxaca, también representa una magnífica oportunidad para desarrolladores. Su terreno y ubicación estratégica son ideales para construir un edificio de departamentos habitacionales. Con la demanda de viviendas en la zona, este proyecto podría ofrecer una excelente inversión y proporcionar espacios modernos y funcionales para futuros residentes. Una propuesta atractiva para aquellos interesados en el desarrollo inmobiliario y maximizar el potencial de este valioso terreno.  (3)",1 jun 2023 - Publicado por REMAX cantera,68020.0,5.0
