title,seller,property_type,address,price,bedrooms,bathrooms,built_area,land_area,description,publication_date,zip_code,parking
CASA DE 5 RECAMARAS EN FRACCIONAMIENTO LOS ALAMOS A 5 MINUTOS DE PLAZA BELLA,lamudi,Casa en Fraccionamiento, alamos,1600000,5.0,2.0,135.0,63.0,"Casa ubicada en el Fraccionamiento los Álamos Infonavit, Montoya, Oax. a cinco minutos de Plaza Bella, de zonas comerciales, escuelas y bancos.Recién remodelada y pintada, en excelentes condiciones, lista para ser habitada.Tres nivelesPrimer nivel• Cochera un auto techada• Sala• Comedor• Cocina• Cisterna 10 mil lSegundo nivel• Tres recamaras• Un estudio• Dos baños completosTercer nivel• Terraza• Dos cuartos• Área de lavado63 m2 terreno135 m2 ConstrucciónPRECIO DE VENTA:$1,600,000.00“INMOBILIARIA ZAGAO”Calle Boulevard de La Paz 102Colinas de La Soledad, OaxacaMARIA ZARATE OROZCO,GONZALO GALVAN FLORES,",21 abr 2023 - Publicado por Inmobiliaria Zagao,68026.0,1.0
HERMOSA PROPIEDAD EN OAXACA,lamudi,Casa,miguel aleman valdez,805547,3.0,1.0,200.0,200.0,"¡¡¡TU OPORTUNIDAD DE PATRIMONIO ESTA AQUI!!!Obtén tu nuevo patrimonio familiar con todas las comodidades para ti y tus seres queridos, ubicación privilegiada, rodeada por las principales vías de comunicación, escuelas, bancos, hospitales, parques, etc.¡¡Te ayudo a que tu nueva propiedad sea una realidad!!Cuento con Propiedades en toda la Republica MexicanAhorra intereses y beneficiate con una compra con recurso propio...iSolicita tu cita Presencial o Virtual!Tu sueño inicia aquí...",26 abr 2023 - Publicado por EJECUTIVOS HIPOTECARIOS - DAVE HERNANDEZ,68120.0,
HERMOSA CASA EN OAXACA,lamudi,Casa, trinidad de las huertas,749900,3.0,2.0,127.0,180.0,"UNA DE LAS CASAS MEJOR UBICADAS, A TAN SOLO UNOS MINUTOS DEL CENTRO DE LA CIUDAD, RODEADA DE TODOS LOS SERVICIOS COMO HOSPITALES, CENTROS COMERCIALES (PLAZA OAXACA), A UNAS CALLES DE LA UNIVERSIDAD AUTONOMA BENITO JUAREZ DE OAXACA.",20 jun 2023 - Publicado por Ejecutivos hipotecarios - ISRA DOMINGUEZ,68080.0,
VENTA DE CASA EN XIPETOTEC COL VILLA DE MONTE ALBAN OAXACA OAXACA,lamudi,Casa, villas montealban,568000,2.0,1.0,94.0,60.0,"EXCELENTE OPORTUNIDAD DE ADQUIRIR HERMOSA CASA LA DISTRIBUCIÓN ES: SALA, COMEDORCOCINA2 RECAMARAS AMPLIAS1 BAÑO CUARTO DE LAVADO. COSTO TOTAL DE LA PROPIEDAD: 568.000 MIL PESOSEXCELENTE UBICACIÓNCERCA DE: CENTROS COMERCIALES, UNIVERSIDADES, ESCUELAS, HOSPITALES, CLINICAS, CAFETERIAS, TIENDAS DE AUTO SERVICIO, BANCOS Y PARQUES","Hace 2 semanas, 6 días - Publicado por Kioto-Paola Magaña",68143.0,
"VENTA DE CASA EN OAXACA, VILLA DE MONTE ALBAN, OAXACA, OAXACA",lamudi,Casa, villas montealban,568000,2.0,1.0,94.0,60.0,"EXCELENTE OPORTUNIDAD DE ADQUIRIR HERMOSACASA LA DISTRIBUCIÓN ES: SALA, COMEDOR, COCINA, 2 RECAMARAS AMPLIAS,1 BAÑO, CUARTO DE LAVADO. EXCELENTE UBICACIÓNCERCA DE: CENTROS COMERCIALES, UNIVERSIDADES, ESCUELAS, HOSPITALES, CLINICAS, CAFETERIAS, TIENDAS DE AUTO SERVICIO, BANCOS Y PARQUES",5 jul 2023 - Publicado por Kioto-ANDRES MONTES,68143.0,
"VENTA DE CASA EN OAXACA, OAXACA, CENTRO, OAXACA, OAX.",lamudi,Casa,manuel sabino crespo,320000,4.0,3.0,380.0,279.0,"GRAN OPORTUNIDAD DE INVERSION CON ESTA GRAN PROPIEDAD, EN EXELENTE COLONIA DEL ESTADO DE OAXACA EMBLEMATICO ESTADO DE LA REPUBLICA, DISTRIBUCION EN DOS PLANTAS CUENTA CON 4 RECAMARAS, 3 BAÑOS SALA, COMEDOR, EXTENSO JARDIN Y PATIO TRASERO.   ESTACIONAMIENTO PARA 2 AUTOS, EXELENTE UBICACIÓN Y ZONA TRANQUILA DE GRAN COMODIDAD EN ACCESOS Y AVENIDAS PRINCIPALES A 2 KM DEL CENTRO DE OAXACA ( ZOCALO ) Y A 1 KM DEL AUDITORIO DE LA GUELAGUETZA","Hace 2 semanas, 6 días - Publicado por Kioto-ANDRES MONTES",68045.0,2.0
VENTA DE CASA EN OAXACA COL. VILLAS DE MONTE ALBAN OAXACA,lamudi,Casa, villas montealban,568000,2.0,1.0,94.0,60.0,"EXCELENTE OPORTUNIDAD DE ADQUIRIR HERMOSACASA LA DISTRIBUCIÓN ES: SALA, COMEDOR, COCINA, 2 RECAMARASAMPLIAS,1 BAÑO, CUARTO DE LAVADO.EXCELENTE UBICACIÓNCERCA DE: CENTROS COMERCIALES, UNIVERSIDADES, ESCUELAS, HOSPITALES, CLINICAS, CAFETERIAS, TIENDAS DE AUTO SERVICIO, BANCOS Y PARQUES MAYORES INFORMES CON EL ARQ. ANDRÈS FREIXAS T.TEL:","Hace 5 días, 21 horas - Publicado por Kioto-Andres Toledo",68143.0,
REMATE BOMNITA CASA EN OAXACA!!!!!,lamudi,Casa,guelaguetza,613653,3.0,2.0,150.0,200.0,"Has crecer tu inversion con esta hermosa casa en OAXACA Con un inicial de $310,000.00 y el resto a ala Cesion de Derechos. Para mayores informes de esta y otras propiedades en CDMX Y TODA LA REPUBLICA, CONTACTAME",26 abr 2023 - Publicado por CONSULTORES PATRIMONIAL - Araceli Canedo,68070.0,
"CASA EN VENTA EN OAXACA DE JUÁREZ, OAXACA CENTRO",lamudi,Casa,guelaguetza,427704,3.0,2.0,150.0,150.0,¡¡¡ EXCELENTE OPORTUNIDAD PARA HABITAR O INVERTIR EN UN INMUEBLE DE RECUPERACIÓN BANCARIA !!!¡¡SOLO PAGO DE CONTADO!!Adquiere esta propiedad de HASTA un 50% por debajo de su valor comercial¡INVIERTE EN TU PATRIMONIO Y EL DE TU FAMILIA!INVERSIÓN PROTEGIDA BAJO CONTRATO. TIEMPO DE 10 A 14 MESES APROX.PRECIOS Y DISPONIBILIDAD SUJETOS A CAMBIO SIN PREVIO AVISO(fotografías ilustrativas únicamente de referencia)CONTACTO: ANAHI VELAZQUEZ CUALQUIER INFORMACIÓN POR WHATSAPP O LLAMADAID: VIO824,27 abr 2023 - Publicado por INTERMEDIA HOME - Anahi Velazquez,68070.0,
"C. de Manuel Sabino Crespo 710, Centro",lamudi,Casa,guelaguetza,320000,4.0,3.0,300.0,279.0,"GRÁN OPORTUNIDAD TANTO DE INVERSIÓN COMO PARA ASEGURAR UN PATRIMONIO, ESTAPROPIEDAD UBICADA EN UNA EXELENTE COLONIA DEL ESTADO DE OAXACA, EMBLEMATICOESTADO DE LA REPUBLICA, CUENTA CON UNA DISTRIBUCIÓN EN DOS PLANTAS, SALA, COMEDOR,EXTENSO JARDIN Y PATIO TRASERO, EXCELENTE UBICACIÓN, ZONA TRANQUILA DE GRANCOMODIDAD EN ACCESOS, AVENIDAS PRINCIPALES A 2 KM DEL CENTRO DE OAXACA ( ZOCALO ) YA 1 KM DEL AUDITORIO DE LA GUELAGUETZA¡¡ SOMOS ESPECIALISTAS EN RECUPERACIÓN DE PROPIEDADES !!CUENTA CON: 4 AMPLIAS RECAMARAS                          3 BAÑOS COMPLETOS                          2 LUGARES DE ESTACIONAMIENTO                          300 M2 DE CONSTRUCCIÓN                          279 M2 DE TERRENOADQUIERELA POR TAN SOLO $320,000.00 MXN¡¡ SOMOS ESPECIALISTAS EN RECUPERACIÓN DE PROPIEDADES !!CONTACTO: LIC. ALEJANDRO GIMÉNEZTEL:","Hace 2 semanas, 1 día - Publicado por Kioto - Alejandro Gimenez",68070.0,2.0
Remate bancario de casa en Oaxaca,lamudi,Casa en Fraccionamiento,san felipe del agua,347740,3.0,2.0,218.0,170.0,"Oportunidad única de inversión en la Hermosa Ciudad de Oaxaca, ubicada dentro de una privada con pocas propiedades y con una superficie de terreno de 170m2 aproximados, esta preciosa casa puede ser tuya a un precio inmejorable muy por debajo del valor comercial del inmueble. La casa cuenta con 3 amplias recamaras, 2 baños, 1 lugar de estacionamiento,área verde al frente, patio trasero de servicio, cocina equipada, amplia estancia sala-comedor, pisos de loseta cerámica en todos los interiores y una muy buena iluminación natural. Dale el espacio a tu familia que siempre has deseado y multiplica tu patrimonio. La casa se ubica a unos minutos de Oaxaca Centro, Universidad La Salle, tiendas departamentales, Bancos, Restaurantes, zona Turística y todo el atractivo que esta ciudad ofrece. No la Dejes Pasar. Agenda una cita y conoce esta atractiva opción que te ofrecemos , acompañamiento jurídico durante todo el proceso. Contáctanos,Pedro Rodríguez Asesor inmobiliario, también contesto WhatsApp.",14 ago 2023 - Publicado por Renovación Patrimonial Monthein - PEDRO RODRIGUEZ,68026.0,1.0
CASA E OAXACA,lamudi,Casa, trinidad de las huertas,899000,3.0,2.0,180.0,180.0,"¡¡Gran Venta Especial!!Obtén tu nuevo patrimonio familiar con una ubicación privilegiada, rodeada por las principales vías de comunicación, medios de transporte, mercados, centros comerciales, escuelas, bancos, hospitales, zonas de recreación y localidades de importancia como: Hospital Diana, Gimnasio Universitario.También Avenidas conocidas como: Av. Oaxaca, Av. Universidad.   •Solo Capital Propio•Agenda tu cita y conoce más detalles de TU NUEVA CASA",23 jun 2023 - Publicado por Ejecutivos hipotecarios - CARLOS GUTIERREZ,68080.0,
VENTA DE CASA COLONIA AGENCIA DE POLICIAS GUADALUPE VICTORIA OAXACA OX,lamudi,Casa,ejido guadalupe victoria,510000,4.0,3.0,350.0,200.0,"EXCELENTE OPORTUNIDAD DE HACER CRECER TU PATRIMONIO, TENGO A LA VENTA UNA MARAVILLOSA CASA. CON UNA UBICACION ESPECTACULAR, EN UNA DE LAS ZONAS CON MAYOR VALOR COMERCIAL EN LOS BIENES RAICES, EN LA COLONIA GUADALUPE VICTORIA. OAXACA DE JUAREZ OAXACA, CUENTA EN SUS ALREDEDORES CON PLAZAS COMERCIALES DE 1RA CATEGORIA, ESCUELAS EN TODOS LOS NIVELES EDUCATIVOS, CENTROS DE RECREACION FAMILIAR, PARQUES Y AREAS NATURALES PARA LOS NIÑOS, HOSPITALES Y CENTROS MEDICOS. ADEMAS ACCESO A LA CASA POR LAS PRINCIPALES AVENIDAS DE LA CIUDAD Y LO MAS IMPORTANTE POR SU CERCANIA CON EL CENTRO DE LA CIUDAD REPRESENTA UNA EXCELENTE INVERSION. EL INMUEBLE CUENTA CON 4 RECAMARAS, COCINA, SALA, COMEDOR, ESTUDIO, 3 BAÑOS Y ESTACIONAMIENTO PARA 2 CARROS, ADEMAS ESPACIO PARA SUS MASCOTAS. ES UNA INVERSION SEGURA Y GARANTIZADA BAJO CONTRATO. NOTA: NO SE ACEPTAN CREDITOS. PARA MAYOR INFORMACION COMUNIQUESE CON SU ASESOR INMOBILIARIO.",15 may 2023 - Publicado por Kioto-Pedro Chavez,68277.0,3.0
HERMOSA CASA EN CENTRO DE OAXACA,lamudi,Casa,guelaguetza,427700,4.0,3.0,350.0,270.0,"HERMOSA CASA DE DOS NIVELES, CON EXCELENTE UBICACIÓN, A UNOS MINUTOS DEL CENTRO DE OAXACA, CON TODOS LOS SERVICIOS CERCANOS, COMO ESCUELAS, HOSPITALES, BANCOS, PARQUES Y ACTIVIADES RECREATIVAS. VIAS ALTERNAS FAUSTINO G OLIVERA Y CARRETERA INTERNACIONAL.NO LO DUDES MAS LLEGO TU TIEMPO DE INVERTIR EN TU PROPIEDAD, EN UNA DE LAS MEJORES ZONAS.APROVECHA LOS GRANDES DESCUENTOS QUE TE OFRECEMOS POR DEBAJO DEL 50% DEL VALOR COMERCIAL, SOMOS UNA EMPRESA ESPECIALIZADA EN PROCESOS DE REGULACION E INTERMEDIACION MERCANTIL DE CARTERA VENCIDA PROVENIENTE DE INSTITUCIONES BANCARIAS.**UNICAMENTE PAGO CON RECURSOS PROPIOS***NO SE ACEPTAN CREDITOS HIPOTECARIOS*AGENDA TU CITA PARA ACLARAR TODAS TUS DUDAS.","17 jul 2023 - Publicado por ALEJANDRO VARGAS -Constructora Inmobiliaria Peza, S.A. de C.V.",68070.0,
"EXCELENTE CASA EN FRACCIONAMIENTO VILLAS EL BOSQUE, OAXACA. NO CREDITOS",lamudi,Casa en Fraccionamiento,estrella,887288,3.0,1.0,90.0,70.0,¡ ¡ ¡ Gran oportunidad!!!  Bonita casa en fraccionamiento con todas las comodidades que ¡ ¡ Tu y tu familia necesitan.   ¡ ¡ ¡ Excelente oportunidad sin riesgo de inversion!!!  ¡ ¡ ¡ Todo bajo contrato y notario!!!  ¡ ¡ ¡ Precio entre un 30% hasta un 80% mas bajo de su valor comercial!!!  ¡ ¡ ¡ Inversion garantizada a futuro de 100%!!!  No pierdas la oportunidad hoy es el mejor momento para invertir y hacer crecer tu inversion de manera automatica  ¡ ¡ Aprovecha nuestros grandes descuentos de entre el 30% al 60% sobre el valor comercial de nuestros inmuebles!!  ** precio sujeto a cambio  Rb1. 2-213,10 may 2023 - Publicado por RECUBAN - RECUBAN REMATES 2,68045.0,
NO RENTES MAS VENTA DE CASA LA MEJOR INVERSION,lamudi,Casa,infonavit,467000,3.0,2.0,200.0,200.0,"AMPLIA CASA EN LAURELES DE REFORMA OAXACA,  CON MUY BUENA UBICASION CON VIAS ALTERNAS.  ALTA PLUSVALÍA SERVICIOS CERCANOS COMO ESCUELAS, HOSPITALES, CENTROS Y COMERCIALES. CON UN COSTO MUY POR DEBAJO DEL VALOR COMERCIAL (APROX. 60% POR DEBAJO DEL VALOR COMERCIAL).*NO CRÉDITOS.  *FIRMA ANTE NOTARIO PÚBLICO.YA SEA QUE LA QUIERAS PARA HABITAR, RENTAR O VENDER A SU VALOR COMERCIAL, INVIERTE TU DINERO CON EL MEJOR RENDIMIENTO.NUESTRA  EXPERIENCIA NOS RESPALDAEMPRESA LIDER EN GARANTIAS HIPOTECARIAS CONTACTO: ASESOR INMOBILIARIO:,.","Hace 1 día, 19 horas - Publicado por GP SERVICIOS INMOBILIARIOS - Joseline Torres",68027.0,
CASA EN VENTA 3 RECAMARAS EN SAN FELIPE,lamudi,Casa,residencial alamos,5900000,3.0,3.0,210.0,186.0,"Casa en un conjunto de 5 casas, (es la primera del conjunto) portón eléctrico, ubicada en zona exclusiva de San Felipe del Agua, cerca del Parque Colosio, a pocos minutos del Colegio La Salle, Sport City, cerros de San Felipe, ideal para caminar, andar en bicicleta, entorno campirano y residencial. 185.94 m2 de Superficie 209.82 m2 de Construcción PROPIEDAD CON CARÁCTER DEFINITIVO. Planta Baja: . Medio baño de visitas . Cocina Integral con estufa, campana y tarja doble . Sala- comedor. . Pequeña bodega. . Jardín trasero con palmeras crecidas. . Patio de servicio y cuarto de servicio con baño completo. Salida del área de servicio hacia la cochera) Segundo nivel: . Tres recamaras, la principal con baño completo y vestidor. . Área de estudio o TV. . Un baño completo para las dos recamaras. -Cochera para 2 o 3 autos -Gas estacionario - Cisterna de 10,000 lts - Calentador automático con encendido electrónico. PRECIO DE VENTA: $5,900,000.00 Previa cita: ""INMOBILIARIA ZAGAO"" Calle Boulevard de La Paz 102 Colinas de La Soledad, Oaxaca. MARIA ZARATE OROZCO   GONZALO GALVAN FLORES",20 abr 2023 - Publicado por Inmobiliaria Zagao,68026.0,2.0
CASA DE TRES RECAMARAS EN ZONA CENTRO DIVISIÓN ORIENTE,lamudi,Casa,barrio ex-marquezado,5600000,3.0,2.0,320.0,260.0,"Casa en Zona Centro, sobre División Oriente, a unas cuadras de la Iglesia de la Soledad, a tres minutos de Chedraui, del mercado de Jardín MaderoDos Plantas.Planta baja:· Cochera para 4 autos con portón eléctrico· Cisterna de 4000 litros· Patio amplio· área de lavado· Un cuarto de servicio con baño· Cuarto / bodega.· Cocina con cocina integral, estufa.· Hall· Un baño completo grande· Sala· Comedor· Estudio o recamara.Planta alta:· Hall· Tres recamaras con closet grandes· Un baño completo grande· Terraza.260 m2 de terreno320 m2 construcciónPRECIO DE VENTA:$5,600,000.00“INMOBILIARIA ZAGAO”Calle Boulevard de La Paz 102Colinas de La Soledad, OaxacaMARIA ZARATE OROZCO,GONZALO GALVAN FLORES",21 abr 2023 - Publicado por Inmobiliaria Zagao,68034.0,4.0
CASA EN VENTA DE 2 RECAMARAS CON TERRAZA EN EL CENTRO,lamudi,Casa,barrio el peñasco,11000000,2.0,2.0,188.0,155.0,"Excelente y hermosa casa ubicada en una de las mejores zonas de la ciudad de Oaxaca, a pocas calles a Santo Domingo, a la Iglesia de la Soledad y al zócalo, caminando se llega a diferentes zonas de interés, como el mercado 20 de noviembre, mercado de artesanías, museos, hoteles, casas de artesanías, bares, restaurantes típicos de comida oaxaqueña vegetariana y veganos, mercaditos orgánicos, plazas comerciales, bancos, casas de cambio, el famoso corredor turístico en la Calle de Alcalá.Se encuentra en un conjunto de 7 casas, accesando por una entrada común, es una casa donde se siente y se vive Oaxaca por toda la decoración y estilo típico oaxaqueño, mejor conocida como ""CASA SABINA"" por la emblemática ""María Sabina"" curandera, chaman mazateca y sabia de los hongos sagrados y sanadores del estado de Oaxaca-México.Es una casa remodelada recientemente, pensada y proyectada con todas las comodidades y para disfrutar de ella por estar en el corazón de Oaxaca y su bella terraza con una vista maravillosa a la ciudad.Actualmente se renta por Airbnb, donde la anfitriona es súper host.PLANTA BAJA:- Patio-pórtico en entrada a la casa, con una pequeña bodeguita.- Sala.- Comedor.- Un baño completo.- Cocina integral con barra desayunador.- Patio interior.- Área de servicio (lavadero, calentador de gas, instalación para lava-secadora).SEGUNDO NIVEL:- Hall o sala de estar- Dos recamaras amplias:- Recamara 1 con pequeño balcón y closet.- Recamara 2 con terraza y hermosa vista.- Un baño completo.- Segundo hall o sala de estar o como estudio.TERRAZA:- Amplia y fascinante terraza techada con estructura metálica con techo de carrizo con un diseño artesanal, con increíble vista a la ciudad de Oaxaca, con vista a la Iglesia de la Soledad y Santo Domingo, existe un anexo de la terraza para usos múltiples como acondicionar una cocina con asador, un taller, practicar yoga, etc.AMENIDADES:- Cisterna de 8 mil litros.- Pisos antiderrapantes en los baños.- Excelentes luminarias artesanales en toda la casa- Cortinas artesanales.- Cámara de vigilancia- Un tinaco de 1,100 litros.PRECIO DE VENTA:$11,000,000.00 (sin amueblar, se pueden vender algunos muebles a elección)PREVIA CITA:""INMOBILIARIA ZAGAO""Calle Boulevard de La Paz 102Colinas de La Soledad, OaxacaMARIA ZARATE OROZCO  GONZALO GALVAN FLORES",20 abr 2023 - Publicado por Inmobiliaria Zagao,68075.0,
CASA NUEVA EN VENTA 3 RECAMARAS COL.LOMA LINDA,lamudi,Casa,loma linda,6600000,3.0,4.0,280.0,147.0,"Hermosa y amplia casa con espacios acogedores para toda la familia, para estrenar con todas las comodidades y amenidades de buen gusto, con un toque moderno con acabados de primera calidad.Ubicada en la Colonia Loma Linda, con increíble vista a la ciudad, a escasos minutos a San Felipe, Col Reforma, centro, colegios como La Salle, Sport city, plazas, bancos, supermercados y comercio en general.Características:  147 m2 de Terreno  280 m2 de construcciónPLANTA BAJA:  Cochera para dos autos portón eléctrico.  Estancia  Comedor  Medio baño de visitas.  Amplia cocina integral  Patio de servicio con área de lavado. (lavadora, calentador de gas, lavadero)  Jardín trasero.PRIMER NIVEL:  Vestíbulo o hall  Recamara principal con baño completo y vestidor.  Dos recamaras con closet y baño completo cada una.SEGUNDO NIVEL:  Azotea o/y terraza.  Cuarto de servicio  Baño completo de servicio  Escalera de servicio.  Gas estacionario  Pisos de interceramic.  Griferia ""Helvex""  Sistema de bombeo inteligente (La bomba está sumergida en la cisterna).  Ventanas de aluminio.  Puertas y closets con acabados de encino.PRECIO DE VENTA:$6,600,000.00""INMOBILIARIA ZAGAO""Calle Boulevard de La Paz 102Colinas de La Soledad, OaxacaMARIA ZARATE OROZCO  GONZALO GALVAN FLORES",20 abr 2023 - Publicado por Inmobiliaria Zagao,68024.0,2.0
CASA COMERCIAL EN VENTA - (3),lamudi,Casa,5 señores,65000000,10.0,10.0,1236.0,936.0,"¡Oportunidad de Inversión Única! Buscamos Inversionistas para Adquirir una Casa Comercial de 2.5 Niveles ¿Eres un inversionista audaz en busca de una oportunidad excepcional? Te presentamos una propuesta.Detalles Clave de la Propiedad:Casa Comercial de 2.5 Niveles23 Recámaras con Baño Privado: Espacios diseñados para comodidad y privacidad, perfectos para una variedad de enfoques comerciales.Áreas de Sala, Comedor y Cocina: Espacios funcionales que permiten diversas configuraciones para satisfacer las necesidades comerciales.Áreas de Almacén: Ideal para negocios que requieren espacio de almacenamiento o logística.Jardín Encantador: Un rincón de serenidad que agrega un toque especial a la propiedad.EstacionamientoCisterna y Calderas: Infraestructura integral para un funcionamiento sin problemas.Excelente ubicación: Estratégicamente ubicada en una zona de alta demanda y crecimiento comercial.Potencial Comercial Ilimitado: La ubicación estratégica y las características únicas de esta propiedad la hacen perfecta para convertirla en un hotel boutique, residencia estudiantil, posada turística o cualquier otro negocio de hospitalidad, escuelas, oficinas etc. ¡No dejes que esta oportunidad pase de largo! Comunícate con nosotros. Juntos, podemos convertir esta propiedad en un éxito de inversión duradero. (3)","Hace 1 semana, 2 días - Publicado por REMAX cantera",68120.0,1.0
CASA AMUEBLADA EN VENTA 3 RECAMARAS  Y UN BUNGALOW EN SAN FELIPE,lamudi,Casa,san felipe del agua,10300000,3.0,2.0,200.0,450.0,"Casa en venta en un solo nivel muy acogedora y cómoda con un exquisito estilo mexicano, con ladrillo aparente tradicional, con madera, azulejos de talavera en baños, con un amplio y bello jardín, donde se puede disfrutarlo desde un bello pórtico y apreciando los cerros de San Felipe.Ubicada en el bello poblado de San Felipe del agua con buenos accesos a tienditas, supecitos, mercaditos, transporte público, la magnífica iglesia de San Felipe, una excelente zona segura y tranquila, ya que se conecta muy cerca a los cerros de San Felipe para hacer caminatas disfrutando del aire libre en bicicleta o con tu mascota.Edificada en una sola planta, consta de:- Recibidor- Sala con chimenea- Comedor- Cocina integral- Un baño completo para visitas.- Tres recamaras amplias con closets cada una.- La recamara principal con vestidor y baño con tina.- Hermoso pórtico con vista al jardín.- Cochera para dos autos.- Área de lavado- Cisterna e 16 mil litros- Cuarto de servicio con baño.- JardínBungalow de dos nivelesPlanta Baja- Recamara con closet- Baño completoPlanta Alta- Sala- Comedor- Cocina integral- BalcónPRECIO DE VENTA:$10,300,000.00 Previa cita""INMOBILIARIA ZAGAO""Calle Boulevard de La Paz 102Colinas de La Soledad, OaxacaMARIA ZARATE OROZCO  GONZALO GALVAN FLORES",20 abr 2023 - Publicado por Inmobiliaria Zagao,68026.0,2.0
Casa en Venta Trinidad  de las Huertas,lamudi,Casa, trinidad de las huertas,6500000,4.0,3.0,211.0,180.0,"HERMOSA RESIDENCIA EN VENTA EN TRINIDAD DE LAS HUERTASSUPERFICIE DE 180 M2CONSTRUCCION: 211.37M2PROPIEDAD PRIVADA4 RECAMARAS LA PRINCIPAL CON AMPLIO VESTIDOR DE MADERA, JACUZZI Y AIRE ACONDICIONADO3 BAÑOS COMPLETOSBODEGUITACOCINA INTEGRALPATIOAREA DE SERVICIO EN AZOTEACOCHERA PARA DOS AUTOS (PORTON AUTOMATICO)CUENTA CON AVALUO 2023PRECIO DE VENTA: $6,500,000 (SIN MUEBLES). EasyBroker ID: EB-NU1998",2 jul 2023 - Publicado por NORA BAEZ RAMIREZ,68080.0,2.0
VENDO BONITA CASA EN FRACC. JARDINES DE LA SIERRA,lamudi,Casa en Fraccionamiento,monte alban,3350000,3.0,3.0,320.0,325.0,"En venta bonita casa ubicada en el fracc, jardines de la sierra, san martin mexicapam, a pocos minutos del centro de la ciudad, cuenta con cisterna, asador y estudio.",20 abr 2023 - Publicado por INMOBILIARIA GAMALY,68154.0,
VENDO RESIDENCIA SAN FELIPE DEL AGUA PARAJE LA CAÑADITA ACABADOS DE PRIMERA,lamudi,Casa,volcanes,7500000,5.0,4.0,420.0,309.0,"VENDO RESIDENCIA SAN FELIPE DEL AGUA PARAJE LA CAÑADITA (ACABADOS DE PRIMERA) PLANTA BAJA  COCHERA TECHADA DOS CUARTO AREA DE SERVICIO CON BAÑO CISTERNA 14,000 LITROS TERRAZA JARDIN COCINA INTEGRAL DESAYUNADOR SALA COMEDOR ESTUDIO  PLANTA ALTA  SALA DE TELEVISION AREA PARA GIMNASIO TRES RECAMARAS CON BAÑO LA PRINCIPAL CON VESTIDOR Y BALCON MALLA ELÉCTRIFICADA CÁMARAS DE SEGURIDAD  SUPERFICIE DE TERRENO 309 MTS CUADRADOS 420 MTS DE CONSTRUCCION DOBLE ALTURA COSTO NEGOCIABLE $7""500.000 A TRATAR REGIMEN COMUNAL NO CRÉDITOS CÓNTACTOS 95 95 95",20 abr 2023 - Publicado por INMOBILIARIA GAMALY,68020.0,1.0
VENDO AMPLIA CASA EN SAN FELIPE DEL AGUA,lamudi,Casa,volcanes,7700000,3.0,2.0,300.0,182.0,"Vendó casa en San Felipe del agua En fraccionamiento privado de cuatro CasasPrimer nivel cochera dos autos cisterna recibidor medió bañó cocina integral sala comedor con área de juego y bar jardin pequeñoSegundo Nivel recámara principal con bañó vestidor y balcón dos recámaras compartiendo bañoAzoteaCuarto y área de servicio182 metros de terreno300 metros de construcciónPrecio$ 7'7000,000",21 abr 2023 - Publicado por INMOBILIARIA GAMALY,68020.0,1.0
VENDO BONITA CASA EN VALLE ESMERALDA,lamudi,Casa,el arenal,5739000,3.0,2.0,205.0,275.0,"Se vende casa valle esmeralda Entrada restringida Un nivel Terreno 275.74 metros cuadrados 205.22 metros de construcción Cochera dos autos techada Sala comedor cocina integral tres recamaras dos baños y medio $ 5'739,000 a tratar Vias de acceso av universidad rivetas del rio salado col cinco señores Servicios públicos Centros comerciales y educativos dentro del área Vias de acceso av universidad riveras del rio salado col cinco señores entronque diferentes calles Servicios públicos Centros comerciales y educativos dentro del área",21 abr 2023 - Publicado por INMOBILIARIA GAMALY,68126.0,1.0
SE VENDE CASA EN COL. SANTA MARIA EXMARQUEZADO A 2 MIN DE AUDITORIO GUELAGUETZA,lamudi,Casa,lindavista,4100000,3.0,2.0,250.0,195.0,"SE VENDE CASA EN EXCELENTE UBICACIÓN COLONIA SANTA MARÍA EX MARQUESADO, EXTENSIÓN CENTRO HISTÓRICOLa casa cuenta con 195 m2 terreno250 M2 construcción.CARACTERÍSTICAS  COCHERA PARA UN AUTO  RECIBIDOR  COCINA INTEGRAL  PATIO DE SERVICIO  COMEDOR  SALA  FUENTE DE AGUA CON PIEDRA DE RIO Y PEQUEÑA JARDINERA PARA UNA PLANTA DE SOMBRA  3 RECÁMARAS AMPLIAS CON VESTIDOR  2 BAÑOS COMPLETOS PEQUEÑA TERRAZA CON HERMOSA VISTA A LA CIUDAD  PATIO TRASERO DE 10 X 8  CUARTO DE SERVICIO  AMPLIA TERRAZA CON HERMOSA VISTA PANORÁMICA  2 CISTERNAS DE 10,000 LT C/UNA  GAS ESTACIONARIO  TODO BARDEADO.CUENTA CON CAMARAS DE SEGURIDAD.PUERTA PRINCIPAL, ESCALERAS, MUEBLE DE TV, COMEDOR , MUEBLE ESQUINERO (CEDRO) SE QUEDAN EN LA CASA .A 5 MINUTOS DEL CENTRO DE LA CIUDADA 7 MINUTOS DE LA COLONIA REFORMAESCUELAS A CUADRA Y MEDIA.A LA MANO COPPEL, CHEDRAUI, ELEKTRA, BANCOS.A 2 MINUTOS DEL AUDITORIO GUELAGUETZA.$4,300,000. A TRATAR",24 abr 2023 - Publicado por Bienes Raíces Oaxaca,68030.0,1.0
